{
 "$schema": "https://eddy3d-dev.github.io/AIJ-Data-Validation/api/3.2.2/schemas/geometry.schema.json",
 "schema_version": "2.5.0",
 "data_version": "ecbbeee22eb3dfd27a94ee6813bff5e602ce79626b8a6309d0bf136a85e01e62",
 "license": "CC-BY-4.0",
 "case": "C",
 "title": "Case C — 3 × 3 block array",
 "units": "metres (model scale)",
 "frame": {
  "origin": "array centre on the ground plane (centre of the middle block)",
  "x": "+x streamwise at WD = 0 (checked three ways on the data: y -> -y is a symmetry, the x <= -0.25 band is faster than x >= +0.25 in every configuration, and the regression slope of Vs is most negative within 0.8-4.3 deg of +x)",
  "y": "+y lateral",
  "z": "+z up; all points at z = 0.02",
  "wind_direction_rotation": "In the CSV's own frame WD rotates the wind from +x TOWARD -y (the WD = 45 field is mirror-symmetric about y = -x to within the experiment's repeatability, 0.10-0.13 m/s, and not about y = +x, 0.5-0.8 m/s). Figure 3 of the data paper draws the fan rotating toward +y. The two disagree by a y-sign flip; this release keeps the CSV frame, which is the frame the point coordinates live in. The disagreement is invisible at WD = 0.",
  "lateral_sign_applied": 1,
  "coordinate_scale_applied": 1.0
 },
 "default_configuration": "2D",
 "configurations": [
  "2D",
  "0D",
  "1D"
 ],
 "is_boxes": true,
 "files": [
  {
   "configuration": "2D",
   "url": "https://eddy3d-dev.github.io/AIJ-Data-Validation/api/3.2.2/cases/C/geometry.stl?v=b8c31c57c453",
   "path": "cases/C/geometry.stl",
   "media_type": "model/stl",
   "bytes": 14576,
   "sha256": "b8c31c57c453a6cfc97023ad274c1f36b5250bff6662c5fb1d97d7129e52f751",
   "format": "ASCII STL, LF line endings, outward normals, every body closed and consistently wound",
   "source": "generated from the stated dimensions",
   "stats": {
    "triangles": 108,
    "bbox_min": [
     -0.5,
     -0.5,
     0.0
    ],
    "bbox_max": [
     0.5,
     0.5,
     0.4
    ],
    "signed_volume": 0.08,
    "edges": 162,
    "edges_shared_by_two_faces": 162,
    "edges_boundary": 0,
    "edges_non_manifold": 0,
    "bodies": 9,
    "body_contacts": 0,
    "inconsistent_triangles": 0,
    "min_body_volume": 0.008,
    "watertight": true
   },
   "bbox_matches_stated_dimensions": true,
   "render": "https://eddy3d-dev.github.io/AIJ-Data-Validation/assets/geometry/case-c-2d.png",
   "render_caption": "2D: the centre block twice as tall, 2D = 0.40 m.",
   "boxes": [
    {
     "min": [
      -0.5,
      -0.5,
      0.0
     ],
     "max": [
      -0.3,
      -0.3,
      0.2
     ]
    },
    {
     "min": [
      -0.5,
      -0.1,
      0.0
     ],
     "max": [
      -0.3,
      0.1,
      0.2
     ]
    },
    {
     "min": [
      -0.5,
      0.3,
      0.0
     ],
     "max": [
      -0.3,
      0.5,
      0.2
     ]
    },
    {
     "min": [
      -0.1,
      -0.5,
      0.0
     ],
     "max": [
      0.1,
      -0.3,
      0.2
     ]
    },
    {
     "min": [
      -0.1,
      -0.1,
      0.0
     ],
     "max": [
      0.1,
      0.1,
      0.4
     ]
    },
    {
     "min": [
      -0.1,
      0.3,
      0.0
     ],
     "max": [
      0.1,
      0.5,
      0.2
     ]
    },
    {
     "min": [
      0.3,
      -0.5,
      0.0
     ],
     "max": [
      0.5,
      -0.3,
      0.2
     ]
    },
    {
     "min": [
      0.3,
      -0.1,
      0.0
     ],
     "max": [
      0.5,
      0.1,
      0.2
     ]
    },
    {
     "min": [
      0.3,
      0.3,
      0.0
     ],
     "max": [
      0.5,
      0.5,
      0.2
     ]
    }
   ],
   "box_count": 9,
   "analytic_volume": 0.08
  },
  {
   "configuration": "0D",
   "url": "https://eddy3d-dev.github.io/AIJ-Data-Validation/api/3.2.2/cases/C/geometry_0D.stl?v=0f08bcd4dd6b",
   "path": "cases/C/geometry_0D.stl",
   "media_type": "model/stl",
   "bytes": 12961,
   "sha256": "0f08bcd4dd6bd11414a66f1d8d4f80986864e80e72043019e855f04041d2db4a",
   "format": "ASCII STL, LF line endings, outward normals, every body closed and consistently wound",
   "source": "generated from the stated dimensions",
   "stats": {
    "triangles": 96,
    "bbox_min": [
     -0.5,
     -0.5,
     0.0
    ],
    "bbox_max": [
     0.5,
     0.5,
     0.2
    ],
    "signed_volume": 0.064,
    "edges": 144,
    "edges_shared_by_two_faces": 144,
    "edges_boundary": 0,
    "edges_non_manifold": 0,
    "bodies": 8,
    "body_contacts": 0,
    "inconsistent_triangles": 0,
    "min_body_volume": 0.008,
    "watertight": true
   },
   "bbox_matches_stated_dimensions": true,
   "render": "https://eddy3d-dev.github.io/AIJ-Data-Validation/assets/geometry/case-c-0d.png",
   "render_caption": "0D: the centre block removed.",
   "boxes": [
    {
     "min": [
      -0.5,
      -0.5,
      0.0
     ],
     "max": [
      -0.3,
      -0.3,
      0.2
     ]
    },
    {
     "min": [
      -0.5,
      -0.1,
      0.0
     ],
     "max": [
      -0.3,
      0.1,
      0.2
     ]
    },
    {
     "min": [
      -0.5,
      0.3,
      0.0
     ],
     "max": [
      -0.3,
      0.5,
      0.2
     ]
    },
    {
     "min": [
      -0.1,
      -0.5,
      0.0
     ],
     "max": [
      0.1,
      -0.3,
      0.2
     ]
    },
    {
     "min": [
      -0.1,
      0.3,
      0.0
     ],
     "max": [
      0.1,
      0.5,
      0.2
     ]
    },
    {
     "min": [
      0.3,
      -0.5,
      0.0
     ],
     "max": [
      0.5,
      -0.3,
      0.2
     ]
    },
    {
     "min": [
      0.3,
      -0.1,
      0.0
     ],
     "max": [
      0.5,
      0.1,
      0.2
     ]
    },
    {
     "min": [
      0.3,
      0.3,
      0.0
     ],
     "max": [
      0.5,
      0.5,
      0.2
     ]
    }
   ],
   "box_count": 8,
   "analytic_volume": 0.064
  },
  {
   "configuration": "1D",
   "url": "https://eddy3d-dev.github.io/AIJ-Data-Validation/api/3.2.2/cases/C/geometry_1D.stl?v=ac92c8ed427c",
   "path": "cases/C/geometry_1D.stl",
   "media_type": "model/stl",
   "bytes": 14576,
   "sha256": "ac92c8ed427cf8f16d5ce9839449dad4bc5cc96c6690e90586b7a7f703652d13",
   "format": "ASCII STL, LF line endings, outward normals, every body closed and consistently wound",
   "source": "generated from the stated dimensions",
   "stats": {
    "triangles": 108,
    "bbox_min": [
     -0.5,
     -0.5,
     0.0
    ],
    "bbox_max": [
     0.5,
     0.5,
     0.2
    ],
    "signed_volume": 0.072,
    "edges": 162,
    "edges_shared_by_two_faces": 162,
    "edges_boundary": 0,
    "edges_non_manifold": 0,
    "bodies": 9,
    "body_contacts": 0,
    "inconsistent_triangles": 0,
    "min_body_volume": 0.008,
    "watertight": true
   },
   "bbox_matches_stated_dimensions": true,
   "render": "https://eddy3d-dev.github.io/AIJ-Data-Validation/assets/geometry/case-c-1d.png",
   "render_caption": "1D: the centre block as tall as its neighbours, D = 0.20 m.",
   "boxes": [
    {
     "min": [
      -0.5,
      -0.5,
      0.0
     ],
     "max": [
      -0.3,
      -0.3,
      0.2
     ]
    },
    {
     "min": [
      -0.5,
      -0.1,
      0.0
     ],
     "max": [
      -0.3,
      0.1,
      0.2
     ]
    },
    {
     "min": [
      -0.5,
      0.3,
      0.0
     ],
     "max": [
      -0.3,
      0.5,
      0.2
     ]
    },
    {
     "min": [
      -0.1,
      -0.5,
      0.0
     ],
     "max": [
      0.1,
      -0.3,
      0.2
     ]
    },
    {
     "min": [
      -0.1,
      -0.1,
      0.0
     ],
     "max": [
      0.1,
      0.1,
      0.2
     ]
    },
    {
     "min": [
      -0.1,
      0.3,
      0.0
     ],
     "max": [
      0.1,
      0.5,
      0.2
     ]
    },
    {
     "min": [
      0.3,
      -0.5,
      0.0
     ],
     "max": [
      0.5,
      -0.3,
      0.2
     ]
    },
    {
     "min": [
      0.3,
      -0.1,
      0.0
     ],
     "max": [
      0.5,
      0.1,
      0.2
     ]
    },
    {
     "min": [
      0.3,
      0.3,
      0.0
     ],
     "max": [
      0.5,
      0.5,
      0.2
     ]
    }
   ],
   "box_count": 9,
   "analytic_volume": 0.072
  }
 ],
 "render": "https://eddy3d-dev.github.io/AIJ-Data-Validation/assets/geometry/case-c-2d.png"
}
