{
 "$schema": "https://sustainableurbansystems.com/CFD-Test-Cases-Architectural-Institute-of-Japan-AIJ/api/3.0.1/schemas/geometry.schema.json",
 "schema_version": "2.3.0",
 "data_version": "a3b3555182df594d614beff495809c17f0476a18f6946fbaf9666321fb98a49d",
 "license": "CC-BY-4.0",
 "case": "A",
 "title": "Case A — 1:1:2 building",
 "units": "metres (model scale)",
 "frame": {
  "origin": "building centre on the ground plane",
  "x": "+x streamwise (the wind at WD = 0 blows toward +x); building spans x in [-0.04, 0.04]",
  "y": "+y lateral; building spans y in [-0.04, 0.04]; points published on the y <= 0 half by the tunnel's symmetry convention",
  "z": "+z up from the ground; roof at z = 0.16",
  "lateral_sign_applied": 1,
  "coordinate_scale_applied": 1.0
 },
 "default_configuration": "default",
 "configurations": [
  "default"
 ],
 "is_boxes": true,
 "files": [
  {
   "configuration": "default",
   "url": "https://sustainableurbansystems.com/CFD-Test-Cases-Architectural-Institute-of-Japan-AIJ/api/3.0.1/cases/A/geometry.stl?v=89acdfbbff84",
   "path": "cases/A/geometry.stl",
   "media_type": "model/stl",
   "bytes": 1756,
   "sha256": "89acdfbbff84039fd8ef98ca472cdb4953e63b01504740b0fc0b57259005ea12",
   "format": "ASCII STL, LF line endings, outward normals",
   "source": "generated from the stated dimensions",
   "stats": {
    "triangles": 12,
    "bbox_min": [
     -0.04,
     -0.04,
     0.0
    ],
    "bbox_max": [
     0.04,
     0.04,
     0.16
    ],
    "signed_volume": 0.001024,
    "edges": 18,
    "edges_shared_by_two_faces": 18,
    "edges_boundary": 0,
    "edges_non_manifold": 0,
    "watertight": true
   },
   "bbox_matches_stated_dimensions": true,
   "render": "https://sustainableurbansystems.com/CFD-Test-Cases-Architectural-Institute-of-Japan-AIJ/assets/geometry/case-a.png",
   "render_caption": "Isolated 1:1:2 building, b = 0.08 m, H = 0.16 m (model scale); the wind blows along +x.",
   "boxes": [
    {
     "min": [
      -0.04,
      -0.04,
      0.0
     ],
     "max": [
      0.04,
      0.04,
      0.16
     ]
    }
   ],
   "box_count": 1,
   "analytic_volume": 0.001024
  }
 ],
 "render": "https://sustainableurbansystems.com/CFD-Test-Cases-Architectural-Institute-of-Japan-AIJ/assets/geometry/case-a.png"
}
