{
 "$schema": "https://sustainableurbansystems.com/CFD-Test-Cases-Architectural-Institute-of-Japan-AIJ/api/3.0.1/schemas/geometry.schema.json",
 "schema_version": "2.3.0",
 "data_version": "a3b3555182df594d614beff495809c17f0476a18f6946fbaf9666321fb98a49d",
 "license": "CC-BY-4.0",
 "case": "E",
 "title": "Case E — Niigata district",
 "units": "metres (full scale)",
 "frame": {
  "origin": "centre of the reproduced area, ground plane",
  "x": "+x EAST (full-scale metres)",
  "y": "+y NORTH (compass rose in MP_caseE.png)",
  "z": "+z up; all points at z = 2.0",
  "wind_direction_rotation": "Meteorological: the compass name is the direction the wind comes FROM (N = 0 deg blows toward -y, E = 90 deg toward -x), clockwise from north. This case keeps its geographic frame instead of '+x along the wind' because the district is real and its coordinates are the data's.",
  "lateral_sign_applied": 1,
  "coordinate_scale_applied": 1.0
 },
 "default_configuration": "ac",
 "configurations": [
  "ac",
  "bc"
 ],
 "is_boxes": false,
 "files": [
  {
   "configuration": "ac",
   "url": "https://sustainableurbansystems.com/CFD-Test-Cases-Architectural-Institute-of-Japan-AIJ/api/3.0.1/cases/E/geometry.stl?v=f59d27738a49",
   "path": "cases/E/geometry.stl",
   "media_type": "model/stl",
   "bytes": 1211403,
   "sha256": "f59d27738a49edb8a51724c56a6c159ffc53f66f7cd2c05291c6f55ab8f5e5ce",
   "format": "ASCII STL, LF line endings, outward normals",
   "source": "triangulated from case-e.3dm via rhino3dm, layers 'buildings' + 'buildings_new_construction'; 478 of 506 shells were wound inward in the 3dm and are flipped outward here",
   "stats": {
    "triangles": 8436,
    "bbox_min": [
     -201.5,
     -201.0,
     0.0
    ],
    "bbox_max": [
     203.0,
     197.300003,
     60.0
    ],
    "signed_volume": 153746.549560573,
    "edges": 12639,
    "edges_shared_by_two_faces": 12624,
    "edges_boundary": 0,
    "edges_non_manifold": 15,
    "watertight": false
   },
   "bbox_matches_stated_dimensions": null,
   "render": "https://sustainableurbansystems.com/CFD-Test-Cases-Architectural-Institute-of-Japan-AIJ/assets/geometry/case-e-after.png",
   "render_caption": "After construction: the 60 m high-rise and the two 18 m mid-rises (blue) added."
  },
  {
   "configuration": "bc",
   "url": "https://sustainableurbansystems.com/CFD-Test-Cases-Architectural-Institute-of-Japan-AIJ/api/3.0.1/cases/E/geometry_bc.stl?v=25d8af3a7617",
   "path": "cases/E/geometry_bc.stl",
   "media_type": "model/stl",
   "bytes": 1206272,
   "sha256": "25d8af3a7617893a8077d4ed23661caeece421dac3fd048506ceb6b6df2d3552",
   "format": "ASCII STL, LF line endings, outward normals",
   "source": "triangulated from case-e.3dm via rhino3dm, layers 'buildings'; 475 of 503 shells were wound inward in the 3dm and are flipped outward here",
   "stats": {
    "triangles": 8400,
    "bbox_min": [
     -201.5,
     -201.0,
     0.0
    ],
    "bbox_max": [
     203.0,
     197.300003,
     30.0
    ],
    "signed_volume": 138719.097502925,
    "edges": 12585,
    "edges_shared_by_two_faces": 12570,
    "edges_boundary": 0,
    "edges_non_manifold": 15,
    "watertight": false
   },
   "bbox_matches_stated_dimensions": null,
   "render": "https://sustainableurbansystems.com/CFD-Test-Cases-Architectural-Institute-of-Japan-AIJ/assets/geometry/case-e-before.png",
   "render_caption": "Before construction: the existing district, about 400 m across (full scale)."
  }
 ],
 "render": "https://sustainableurbansystems.com/CFD-Test-Cases-Architectural-Institute-of-Japan-AIJ/assets/geometry/case-e-after.png"
}
