{
 "$schema": "https://aij.eddy3d.com/api/3.5.0/schemas/geometry.schema.json",
 "schema_version": "2.5.0",
 "data_version": "249fe518ae281d3b62ab76162a59a358bd385e88e01e94305f4ab90414920c75",
 "license": "CC-BY-4.0",
 "case": "E",
 "title": "Case E — Niigata district",
 "units": "metres (full scale)",
 "frame": {
  "origin": "centre of the reproduced area, ground plane",
  "x": "+x EAST (full-scale metres)",
  "y": "+y NORTH (compass rose in MP_caseE.png)",
  "z": "+z up; all points at z = 2.0",
  "wind_direction_rotation": "meteorological FROM-direction, clockwise from north; the compass name is the direction the wind comes from (N = 0 deg blows toward -y, E = 90 deg toward -x). This case keeps its geographic frame instead of '+x along the wind' because the district is real and its coordinates are the data's.",
  "lateral_sign_applied": 1,
  "coordinate_scale_applied": 1.0
 },
 "default_configuration": "ac",
 "configurations": [
  "ac",
  "bc"
 ],
 "is_boxes": false,
 "files": [
  {
   "configuration": "ac",
   "url": "https://aij.eddy3d.com/api/3.5.0/cases/E/geometry.stl?v=c29624fdae6d",
   "path": "cases/E/geometry.stl",
   "media_type": "model/stl",
   "bytes": 1210554,
   "sha256": "c29624fdae6dbebecbb666ca1bf7b64a0c4c5f0d73cbf947d5c80d6427e96c06",
   "format": "ASCII STL, LF line endings, outward normals, every body closed and consistently wound",
   "source": "triangulated from case-e.3dm via rhino3dm, layers 'buildings' + 'buildings_new_construction'; 478 of 506 shells are wound inward in the 3dm and 1,563 of 8,436 triangles are wound against their neighbours; every body is re-wound here, outward; 1 wall shared by two buildings (4 triangles) is removed, which joins them into one body; 545 bodies, all closed, 11 edges where two bodies touch",
   "stats": {
    "triangles": 8432,
    "bbox_min": [
     -201.5,
     -201.0,
     0.0
    ],
    "bbox_max": [
     203.0,
     197.3,
     60.0
    ],
    "signed_volume": 356615.42465375,
    "edges": 12637,
    "edges_shared_by_two_faces": 12626,
    "edges_boundary": 0,
    "edges_non_manifold": 11,
    "bodies": 545,
    "body_contacts": 11,
    "inconsistent_triangles": 0,
    "min_body_volume": 4.125,
    "watertight": true
   },
   "bbox_matches_stated_dimensions": null,
   "render": "https://aij.eddy3d.com/assets/geometry/case-e-after.png",
   "render_caption": "After construction: the 60 m high-rise and the two 18 m mid-rises (blue) added."
  },
  {
   "configuration": "bc",
   "url": "https://aij.eddy3d.com/api/3.5.0/cases/E/geometry_bc.stl?v=9b944d97a817",
   "path": "cases/E/geometry_bc.stl",
   "media_type": "model/stl",
   "bytes": 1205426,
   "sha256": "9b944d97a8171394cd6440873f6250436ca11c7264a62f715bcb8e785e241ba2",
   "format": "ASCII STL, LF line endings, outward normals, every body closed and consistently wound",
   "source": "triangulated from case-e.3dm via rhino3dm, layers 'buildings'; 475 of 503 shells are wound inward in the 3dm and 1,557 of 8,400 triangles are wound against their neighbours; every body is re-wound here, outward; 1 wall shared by two buildings (4 triangles) is removed, which joins them into one body; 542 bodies, all closed, 11 edges where two bodies touch",
   "stats": {
    "triangles": 8396,
    "bbox_min": [
     -201.5,
     -201.0,
     0.0
    ],
    "bbox_max": [
     203.0,
     197.3,
     30.0
    ],
    "signed_volume": 311533.07465375,
    "edges": 12583,
    "edges_shared_by_two_faces": 12572,
    "edges_boundary": 0,
    "edges_non_manifold": 11,
    "bodies": 542,
    "body_contacts": 11,
    "inconsistent_triangles": 0,
    "min_body_volume": 4.125,
    "watertight": true
   },
   "bbox_matches_stated_dimensions": null,
   "render": "https://aij.eddy3d.com/assets/geometry/case-e-before.png",
   "render_caption": "Before construction: the existing district, about 400 m across (full scale)."
  }
 ],
 "render": "https://aij.eddy3d.com/assets/geometry/case-e-after.png"
}
