{
 "$schema": "https://sustainableurbansystems.com/CFD-Test-Cases-Architectural-Institute-of-Japan-AIJ/api/2.0.0/schemas/geometry.schema.json",
 "schema_version": "2.2.0",
 "data_version": "5af8c81571e452c1925b3efe58c698908066f64886eba5efd9b2f0348ecdc019",
 "license": "CC-BY-4.0",
 "case": "B",
 "title": "Case B — 1:4:4 slab",
 "units": "metres (model scale)",
 "frame": {
  "origin": "building centre on the ground plane",
  "x": "+x streamwise (the wind at WD = 0 blows toward +x); slab spans x in [-0.025, 0.025]",
  "y": "+y lateral; slab spans y in [-0.10, 0.10]; points published on the y <= 0 half by the tunnel's symmetry convention",
  "z": "+z up from the ground; roof at z = 0.20",
  "lateral_sign_applied": -1,
  "coordinate_scale_applied": 0.001
 },
 "default_configuration": "default",
 "configurations": [
  "default"
 ],
 "is_boxes": true,
 "files": [
  {
   "configuration": "default",
   "url": "https://sustainableurbansystems.com/CFD-Test-Cases-Architectural-Institute-of-Japan-AIJ/api/2.0.0/cases/B/geometry.stl?v=e6de70eeb17d",
   "path": "cases/B/geometry.stl",
   "media_type": "model/stl",
   "bytes": 1738,
   "sha256": "e6de70eeb17dfa4d7312223dc3dcc58e996e2573b37fb77d7820b52b7bca354b",
   "format": "ASCII STL, LF line endings, outward normals",
   "source": "generated from the stated dimensions",
   "stats": {
    "triangles": 12,
    "bbox_min": [
     -0.025,
     -0.1,
     0.0
    ],
    "bbox_max": [
     0.025,
     0.1,
     0.2
    ],
    "signed_volume": 0.002,
    "edges": 18,
    "edges_shared_by_two_faces": 18,
    "edges_boundary": 0,
    "edges_non_manifold": 0,
    "watertight": true
   },
   "bbox_matches_stated_dimensions": true,
   "render": "https://sustainableurbansystems.com/CFD-Test-Cases-Architectural-Institute-of-Japan-AIJ/assets/geometry/case-b.png",
   "render_caption": "Isolated 1:4:4 slab, 0.05 m along the wind, 0.20 m across, 0.20 m tall (model scale); the wind blows along +x.",
   "boxes": [
    {
     "min": [
      -0.025,
      -0.1,
      0.0
     ],
     "max": [
      0.025,
      0.1,
      0.2
     ]
    }
   ],
   "box_count": 1,
   "analytic_volume": 0.002
  }
 ],
 "render": "https://sustainableurbansystems.com/CFD-Test-Cases-Architectural-Institute-of-Japan-AIJ/assets/geometry/case-b.png"
}
